{
	"name": "LanguageTool",
	"nameLocale": {
		"ru": "LanguageTool",
		"fr": "LanguageTool",
		"es": "LanguageTool",
		"pt-BR": "LanguageTool",
		"de": "LanguageTool",
		"sq-AL": "LanguageTool",
		"sr-Cyrl-RS": "LanguageTool",
		"sr-Latn-RS": "LanguageTool",
		"zh-ZH": "LanguageTool"
	},
	"guid": "asc.{7CDB02C9-A0BF-4B56-9A1A-71C860B8498F}",
	"version": "1.0.6",

	"variations": [
		{
			"description": "Improve spelling, grammar, and style in your texts.",
			"descriptionLocale": {
				"ru": "Исправляйте орфографические, грамматические и стилистические ошибки в ваших документах.",
				"fr": "Améliorez l'orthographe, la grammaire et le style de vos textes.",
				"es": "Mejore la ortografía, la gramática y el estilo de sus textos.",
				"pt-BR": "Melhore a ortografia, a gramática e o estilo dos seus textos.",
				"de": "Verbessern Sie Rechtschreibung, Grammatik und Stil in Ihren Texten.",
				"sq-AL": "Përmirësoni ortografinë, gramatikën dhe stilin në tekstet tuaja.",
				"sr-Cyrl-RS": "Побољшајте правопис, граматику и стил у својим текстовима.",
				"sr-Latn-RS": "Poboljšajte pravopis, gramatiku i stil u svojim tekstovima.",
				"zh-ZH": "改进文本的拼写、语法和样式。"
			},
			"url": "index.html",

			"icons": [ "resources/light/icon.png", "resources/light/icon@2x.png" ],
			"icons2": [
				{
					"style" : "light",
					
					"100%": {
						"normal": "resources/light/icon.png"
					},
					"125%": {
						"normal": "resources/light/icon@1.25x.png"
					},
					"150%": {
						"normal": "resources/light/icon@1.5x.png"
					},
					"175%": {
						"normal": "resources/light/icon@1.75x.png"
					},
					"200%": {
						"normal": "resources/light/icon@2x.png"
					}
				},
				{
					"style" : "dark",
					
					"100%": {
						"normal": "resources/dark/icon.png"
					},
					"125%": {
						"normal": "resources/dark/icon@1.25x.png"
					},
					"150%": {
						"normal": "resources/dark/icon@1.5x.png"
					},
					"175%": {
						"normal": "resources/dark/icon@1.75x.png"
					},
					"200%": {
						"normal": "resources/dark/icon@2x.png"
					}
				}
			],
			"isViewer": true,
			"EditorsSupport": [ "word", "cell", "slide", "pdf" ],

			"isVisual": true,
			"isModal": true,
			"isInsideMode": true,

			"initDataType": "text",
			"initData": "",

			"isUpdateOleOnResize": false,

			"buttons": [],

			"initOnSelectionChanged": true,

			"store": {
				"background": {
					"light" : "#357EE5",
					"dark" : "#357EE5"
				},
				"screenshots" : [
					"resources/store/screenshots/screen_1.png",
					"resources/store/screenshots/screen_2.png",
					"resources/store/screenshots/screen_3.png"
				],
				"icons"	   : {
					"light" : "resources/store/icons",
					"dark"  : "resources/store/icons"
				},
				"categories": ["specAbilities", "work", "recommended"]
			}
		},
		{
			"description": "About",
			"descriptionLocale": {
				"ru": "Справка",
				"fr": "À propos",
				"es": "Sobre programa",
				"de": "Über",
				"sq-AL": "Rreth",
				"sr-Cyrl-RS": "У вези",
				"sr-Latn-RS": "U vezi",
				"zh-ZH": "关于"
			},
			"url": "index_about.html",

			"icons": [ "resources/img/icon.png", "resources/img/icon@2x.png", "resources/img/icon.png", "resources/img/icon@2x.png" ],
			"isViewer": true,
			"EditorsSupport": [ "word", "cell", "slide" ],

			"isVisual": true,
			"isModal": true,
			"isInsideMode": false,

			"initDataType": "none",
			"initData": "",

			"isUpdateOleOnResize": false,

			"buttons": [
				{
					"text": "Ok",
					"primary": true
				}
			],

			"size": [ 400, 50 ]
		}
	]
}