{
	"name": "Doc2md",
	"nameLocale": {
		"ru": "Doc2md",
		"fr": "Doc2md",
		"es": "Doc2md",
		"pt-BR": "Doc2md",
		"de": "Doc2md",
		"sq-AL": "Doc2md",
		"sr-Cyrl-RS": "Doc2md",
		"sr-Latn-RS": "Doc2md",
		"zh-ZH": "Doc2md"
	},
	"offered": "Ascensio System SIA",
	"guid": "asc.{5aff455d-96c4-4bd8-9658-16e5bc143738}",
	"version": "1.0.3",
	"minVersion" : "7.4.0",
	"variations": [
		{
			"description": "Convert your formatted documents to Markdown or HTML.",
			"descriptionLocale": {
				"ru": "Преобразуйте отформатированные документы в Markdown или HTML.",
				"fr": "Convertissez votre document mis en forme en Markdown ou HTML.",
				"es": "Convierta sus documentos formateados a Markdown o HTML.",
				"pt-BR": "Converta seus documentos formatados para Markdown ou HTML.",
				"de": "Konvertieren Sie formatierte Dokumente in Markdown oder HTML.",
				"cs": "Převeďte své formátované dokumenty na Markdown nebo HTML.",
				"sq-AL": "Konvertoni dokumentet tuaja të formatizuara në Markdown ose HTML.",
				"sr-Cyrl-RS": "Конвертујте ваше форматиране документе у Markdown или HTML.",
				"sr-Latn-RS": "Konvertujte vaše formatirane dokumente u Markdown ili HTML.",
				"zh-ZH": "将文档转换为 Markdown 或 HTML 格式。"
			},
			"url": "index.html",
			"icons": [ "resources/light/icon.png", "resources/light/icon@2x.png" ],
			"icons2": [
				{
					"style" : "light",
					
					"100%": {
						"normal": "resources/light/icon.png",
						"hover": "resources/light/icon.png",
						"active": "resources/light/icon.png"
					},
					"125%": {
						"normal": "resources/light/icon@1.25x.png"
					},
					"150%": {
						"normal": "resources/light/icon@1.5x.png"
					},
					"175%": {
						"normal": "resources/light/icon@1.75x.png"
					},
					"200%": {
						"normal": "resources/light/icon@2x.png"
					}
				},
				{
					"style" : "dark",
					
					"100%": {
						"normal": "resources/dark/icon.png"
					},
					"125%": {
						"normal": "resources/dark/icon@1.25x.png"
					},
					"150%": {
						"normal": "resources/dark/icon@1.5x.png"
					},
					"175%": {
						"normal": "resources/dark/icon@1.75x.png"
					},
					"200%": {
						"normal": "resources/dark/icon@2x.png"
					}
				}
			],
			"isViewer": true,
			"EditorsSupport": [ "word" ],
			"isVisual": true,
			"isModal": true,
			"isInsideMode": true,
			"initDataType": "text",
			"isUpdateOleOnResize": false,
			"initOnSelectionChanged": true,
			"store": {
				"background": {
					"light" : "#333333",
					"dark" : "#444444"
				},
				"screenshots" : [
					"resources/store/screenshots/screen_1.png",
					"resources/store/screenshots/screen_2.png"
				],
				"icons" : {
					"light" : "resources/store/icons",
					"dark"  : "resources/store/icons"
				},
				"categories": ["specAbilities", "work"]
			}
		},
		{
			"description": "About",
			"descriptionLocale": {
				"ru": "Справка",
				"fr": "À propos",
				"es": "Sobre programa",
				"de": "Über",
				"sq-AL": "Rreth",
				"zh-ZH": "关于"
			},
			"url": "index_about.html",
			"icons": [ "resources/img/icon.png", "resources/img/icon@2x.png", "resources/img/icon.png", "resources/img/icon@2x.png" ],
			"isViewer": true,
			"EditorsSupport": [ "word" ],
			"isVisual": true,
			"isModal": true,
			"isInsideMode": false,
			"initDataType": "none",
			"isUpdateOleOnResize": false,
			"buttons": [
				{
					"text": "Ok",
					"primary": true
				}
			],
			"size": [ 400, 50 ]
		}
	]
}
