{
  "name": "Antidote",
  "offered": "Druide informatique inc.",
  "guid": "asc.{ANTIDOTE-1RX8-0FQM-R98O-XSS4P72PO236}",
  "version": "12.4.0",
  "minVersion": "9.4.0",
  "help": "https://antidote.info",
  "nameLocale": {
    "fr": "Antidote",
    "en": "Antidote"
  },
  "baseUrl": "",
  "variations": [
    {
      "description": "Check spelling, grammar and style with Antidote, and look words up in its Dictionaries and Guides.",
      "descriptionLocale": {
        "fr": "Corrigez l'orthographe, la grammaire et le style avec Antidote, et consultez ses Dictionnaires et Guides.",
        "en": "Check spelling, grammar and style with Antidote, and look words up in its Dictionaries and Guides."
      },
      "url": "index.html",
      "icons": "resources/img/bouton/%theme-type%(light|dark)/icon%scale%(default).%extension%(png)",
      "isViewer": false,
      "EditorsSupport": [
        "word"
      ],
      "isVisual": true,
      "isModal": false,
      "isInsideMode": true,
      "initDataType": "none",
      "initData": "",
      "isUpdateOleOnResize": false,
      "buttons": [],
      "initOnSelectionChanged": false,
      "store": {
        "background": {
          "light": "#E2E88C",
          "dark": "#E2E88C"
        },
        "screenshots": [
          "resources/img/store/capture/ecran_1.png",
          "resources/img/store/capture/ecran_2.png"
        ],
        "icons": {
          "light": "resources/img/store/icons",
          "dark": "resources/img/store/icons"
        },
        "categories": [
          "specAbilities",
          "work"
        ]
      }
    }
  ]
}
