{
    "name" : "Glavred",
    "nameLocale": {
        "ru": "Главред"
    },
    "guid" : "asc.{B631E142-E40B-4B4C-90B9-2D00222A286E}",
    "version" : "1.0.0",

    "variations" : [
        {
            "description" : "Glavred",
            "descriptionLocale": {
                "ru": "Главред"
            },
            "url"         : "index.html",

            "icons": [ "resources/light/icon.png", "resources/light/icon@2x.png" ],
            "icons2": [
                {
                    "style" : "light",
                    
                    "100%": {
                        "normal": "resources/light/icon.png"
                    },
                    "125%": {
                        "normal": "resources/light/icon@1.25x.png"
                    },
                    "150%": {
                        "normal": "resources/light/icon@1.5x.png"
                    },
                    "175%": {
                        "normal": "resources/light/icon@1.75x.png"
                    },
                    "200%": {
                        "normal": "resources/light/icon@2x.png"
                    }
                },
                {
                    "style" : "dark",
                    
                    "100%": {
                        "normal": "resources/dark/icon.png"
                    },
                    "125%": {
                        "normal": "resources/dark/icon@1.25x.png"
                    },
                    "150%": {
                        "normal": "resources/dark/icon@1.5x.png"
                    },
                    "175%": {
                        "normal": "resources/dark/icon@1.75x.png"
                    },
                    "200%": {
                        "normal": "resources/dark/icon@2x.png"
                    }
                }
            ],
            "isViewer"        : true,
            "EditorsSupport"  : ["word"],
            "isVisual"        : true,
            "isModal"         : true,
            "isInsideMode"    : false,
            "initDataType"    : "text",
            "isUpdateOleOnResize" : false,
            "buttons"         : [ { "text": "Ok", "primary": true } ],
            "store": {
                "background": {
                    "light" : "#ED6300",
                    "dark" : "#ED6300"
                },
                "screenshots" : ["resources/store/screenshots/screen_1.png"],
                "icons"       : {
                    "light" : "resources/store/icons",
                    "dark"  : "resources/store/icons"
                } 
            }
        }
    ]
}